Movie ID,Title,Year,Genre,User Rating,Director,Stars,User ID
tt6846632,National Theatre Live: Salomé,2017,Drama,5.0,Yaël Farber,"Matthew Amos, Olwen Fouéré, Shahar Isaac, Paul Chahidi, Uriel Emil",ur20552756
tt1660055, Scooby-Doo! Mystery Incorporated,2010–2013,"Animation, Adventure, Comedy",10.0,Michael Goguen,"Frank Welker, Mindy Cohn, Grey Griffin, Matthew Lillard",ur20552756
tt11281876, My Little Pony: Pony Life,2020–2021,"Animation, Comedy, Family",3.0,Ashleigh Ball,"Andrea Libman, Tabitha St. Germain, Tara Strong",ur20552756
tt12768740, The Pink Panther,1969–1978,"Animation, Short, Comedy",8.0,,,ur20552756
tt0151916,Pastry Panic,1951,"Animation, Short",5.0,Mannie Davis,Tom Morrison,ur20552756
tt8456094, Scooby-Doo and Guess Who?,2019–2021,"Animation, Adventure, Comedy",5.0,Mike Milo,"Frank Welker, Grey Griffin, Matthew Lillard, Kate Micucci",ur20552756
tt0083467, The Powers of Matthew Star,1982–1983,"Action, Adventure, Sci-Fi",5.0,Guy Magar,"Peter Barton, Amy Steel, Louis Gossett Jr., Chip Frye",ur2483625
tt0066685, McMillan & Wife,1971–1977,"Crime, Drama, Mystery",5.0,Bob Finkel,"Rock Hudson, John Schuck, Martha Raye, Richard Gilliland",ur2483625
tt0029453,Pépé le Moko,1937,"Crime, Drama, Romance",8.0,Julien Duvivier,"Jean Gabin, Gabriel Gabrio, Saturnin Fabre, Fernand Charpin",ur2483625
tt0066685, McMillan & Wife,1971–1977,"Crime, Drama, Mystery",5.0,Alex March,"Rock Hudson, Susan Saint James, John Schuck, Nancy Walker",ur2483625
tt0071200,The Beast Must Die,1974,"Horror, Mystery",5.0,Paul Annett,"Calvin Lockhart, Peter Cushing, Marlene Clark, Charles Gray",ur2483625
tt0096732, The Young Riders,1989–1992,"Drama, Romance, Western",8.0,Michael Preece,"Stephen Baldwin, Josh Brolin, Travis Fine, Don Franklin",ur2483625
tt0052451, Bonanza,1959–1973,Western,4.0,John Rich,"Lorne Greene, Dan Blocker, Michael Landon, Dawn Wells",ur2483625
tt0025835,Story Conference,1934,"Comedy, Musical, Short",6.0,Roy Mack,"Lillian Roth, The Sizzlers, The Three Minutes, Bert Matthews",ur2483625
tt0096732, The Young Riders,1989–1992,"Drama, Romance, Western",7.0,Richard Compton,"Stephen Baldwin, Josh Brolin, Travis Fine, Don Franklin",ur2483625
tt0066685, McMillan & Wife,1971–1977,"Crime, Drama, Mystery",6.0,Daniel Petrie,"Rock Hudson, Susan Saint James, John Schuck, Nancy Walker",ur2483625
tt0034804,The Gorilla Man,1943,"Action, Adventure, Drama",4.0,D. Ross Lederman,"John Loder, Ruth Ford, Marian Hall, Richard Fraser",ur2483625
tt0068044, Banacek,1972–1974,"Crime, Drama, Mystery",6.0,Bernard L. Kowalski,"George Peppard, Margot Kidder, Don Porter, Murray Matheson",ur2483625
tt0036864,Gildersleeve's Ghost,1944,"Adventure, Comedy, Fantasy",3.0,Gordon Douglas,"Harold Peary, Marion Martin, Richard LeGrand, Amelita Ward",ur2483625
tt0066685, McMillan & Wife,1971–1977,"Crime, Drama, Mystery",7.0,Gary Nelson,"Rock Hudson, Susan Saint James, John Schuck, Nancy Walker",ur2483625
tt0052451, Bonanza,1959–1973,Western,4.0,Leon Benson,"Lorne Greene, Dan Blocker, Michael Landon, Jack Albertson",ur2483625
tt0034583,Casablanca,1942,"Drama, Romance, War",10.0,Michael Curtiz,"Humphrey Bogart, Ingrid Bergman, Paul Henreid, Claude Rains",ur0813657
tt3609352,Grace and Frankie,2015–2022,Comedy,10.0,Jane Fonda,"Lily Tomlin, Sam Waterston, Martin Sheen",ur0813657
tt1626146,Hector and the Search for Happiness,2014,"Adventure, Comedy, Drama",10.0,Peter Chelsom,"Simon Pegg, Rosamund Pike, Tracy-Ann Oberman, Jean Reno",ur0813657
tt0081398,Raging Bull,1980,"Biography, Drama, Sport",10.0,Martin Scorsese,"Robert De Niro, Cathy Moriarty, Joe Pesci, Frank Vincent",ur0813657
tt0090060,St. Elmo's Fire,1985,"Drama, Romance",2.0,Joel Schumacher,"Demi Moore, Rob Lowe, Andrew McCarthy, Emilio Estevez",ur0813657
tt0898266,The Big Bang Theory,2007–2019,"Comedy, Romance",10.0,Johnny Galecki,"Jim Parsons, Kaley Cuoco, Simon Helberg",ur0813657
tt0051666,God's Little Acre,1958,"Comedy, Drama, Romance",10.0,Anthony Mann,"Robert Ryan, Tina Louise, Aldo Ray, Buddy Hackett",ur0813657
tt0796366,Star Trek,2009,"Action, Adventure, Sci-Fi",10.0,J.J. Abrams,"Chris Pine, Zachary Quinto, Simon Pegg, Leonard Nimoy",ur0813657
tt1408101,Star Trek Into Darkness,2013,"Action, Adventure, Sci-Fi",10.0,J.J. Abrams,"Chris Pine, Zachary Quinto, Zoe Saldana, Benedict Cumberbatch",ur0813657
tt0098300,Shag,1988,"Comedy, Drama, Romance",10.0,Zelda Barron,"Phoebe Cates, Bridget Fonda, Scott Coffey, Annabeth Gish",ur0813657
tt0268978,A Beautiful Mind,2001,"Biography, Drama, Mystery",10.0,Ron Howard,"Russell Crowe, Ed Harris, Jennifer Connelly, Christopher Plummer",ur0813657
tt0085478,Educating Rita,1983,"Comedy, Drama",10.0,Lewis Gilbert,"Michael Caine, Julie Walters, Michael Williams, Maureen Lipman",ur0813657
tt1074638,Skyfall,2012,"Action, Adventure, Thriller",10.0,Sam Mendes,"Daniel Craig, Javier Bardem, Naomie Harris, Judi Dench",ur0813657
tt0110912,Pulp Fiction,1994,"Crime, Drama",10.0,Quentin Tarantino,"John Travolta, Uma Thurman, Samuel L. Jackson, Bruce Willis",ur0813657
tt0060028, Star Trek,1966–1969,"Action, Adventure, Sci-Fi",10.0,Marc Daniels,"William Shatner, Leonard Nimoy, Ricardo Montalban, Madlyn Rhue",ur0813657
tt9288030,Reacher,2022– ,"Action, Crime, Drama",8.0,Alan Ritchson,"Maria Sten, Malcolm Goodwin, Willa Fitzgerald",ur5156288
tt3530232, Last Week Tonight with John Oliver,2014– ,"Comedy, News, Talk-Show",8.0,Paul Pennolino,"John Oliver, Charles F. Bolden Jr., Jim Cantrell, Nick Fuentes",ur5156288
tt3530232, Last Week Tonight with John Oliver,2014– ,"Comedy, News, Talk-Show",8.0,Paul Pennolino,"John Oliver, Steve Bannon, Matt Berry, Jim Cramer",ur5156288
tt3530232, Last Week Tonight with John Oliver,2014– ,"Comedy, News, Talk-Show",8.0,Paul Pennolino,"Jim Cramer, David Kaye, John Oliver, George Santos",ur5156288
tt3530232, Last Week Tonight with John Oliver,2014– ,"Comedy, News, Talk-Show",8.0,Paul Pennolino,"David Kaye, Tim Bagley, James Comer, Katie Hartman",ur5156288
tt3530232, Last Week Tonight with John Oliver,2014– ,"Comedy, News, Talk-Show",9.0,Paul Pennolino,"John Oliver, David Kaye, Dana Bash, Rachel Campos-Duffy",ur5156288
tt3530232, Last Week Tonight with John Oliver,2014– ,"Comedy, News, Talk-Show",9.0,Paul Pennolino,"John Oliver, David Kaye, Stephen Fry, Amanda Zurawski",ur5156288
tt3530232, Last Week Tonight with John Oliver,2014– ,"Comedy, News, Talk-Show",8.0,Paul Pennolino,"John Oliver, David Kaye, Ryan Barger, Molly Brown",ur5156288
tt3530232, Last Week Tonight with John Oliver,2014– ,"Comedy, News, Talk-Show",9.0,Paul Pennolino,"John Oliver, Victor Blackwell, Walt Bogdanich, Ronny Chieng",ur5156288
tt3530232, Last Week Tonight with John Oliver,2014– ,"Comedy, News, Talk-Show",8.0,Paul Pennolino,"John Oliver, David Kaye, Don Bacon, Jim Cramer",ur5156288
tt3530232, Last Week Tonight with John Oliver,2014– ,"Comedy, News, Talk-Show",8.0,Paul Pennolino,"John Oliver, David Kaye",ur5156288
tt3530232, Last Week Tonight with John Oliver,2014– ,"Comedy, News, Talk-Show",9.0,Paul Pennolino,"John Oliver, Ryan Barger, Fall Out Boy, Billy Joel",ur5156288
tt3530232, Last Week Tonight with John Oliver,2014– ,"Comedy, News, Talk-Show",8.0,Paul Pennolino,"John Oliver, David Kaye, Ryan Barger, Joe Biden",ur5156288
tt3530232, Last Week Tonight with John Oliver,2014– ,"Comedy, News, Talk-Show",9.0,Paul Pennolino,"John Oliver, David Kaye, Sam Bankman-Fried, Tom Brady",ur5156288
tt3530232, Last Week Tonight with John Oliver,2014– ,"Comedy, News, Talk-Show",8.0,Paul Pennolino,"John Oliver, David Kaye, Ryan Barger, Brian McCarthy",ur5156288
tt8415836,Guillermo del Toro's Cabinet of Curiosities,2022,"Drama, Horror, Mystery",7.0,Lize Johnston,"Kevin Keppy, Kate Micucci, Tim Blake Nelson",ur2898520
tt14190592,The Lazarus Project,2022–2023,"Action, Drama, Fantasy",6.0,Paapa Essiedu,"Anjli Mohindra, Rudi Dharmalingam, Caroline Quentin",ur2898520
tt21692408,Kung Fu Panda 4,2024,"Animation, Action, Adventure",7.0,Mike Mitchell,"Stephanie Stine, Jack Black, Awkwafina, Viola Davis, Dustin Hoffman",ur2898520
tt0025066,Down to Their Last Yacht,1934,"Comedy, Musical, Romance",4.0,Paul Sloane,"Mary Boland, Polly Moran, Ned Sparks, Sidney Fox",ur2898520
tt14992524,The Fearway,2023,"Horror, Sci-Fi, Thriller",5.0,Robert Gajic,"Shannon Dalonzo, Simon Phillips, Eileen Dietz, Jessica Gray",ur2898520
tt0042980,So Long at the Fair,1950,"Drama, Mystery",6.0,Antony Darnborough,"Terence Fisher, Jean Simmons, Dirk Bogarde, David Tomlinson, Honor Blackman",ur2898520
tt0064035,The Appointment,1969,"Drama, Romance",5.0,Sidney Lumet,"Omar Sharif, Anouk Aimée, Didi Perego, Fausto Tozzi",ur2898520
tt15477042,Waitress: The Musical,2023,"Comedy, Drama, Musical",7.0,Diane Paulus,"Brett Sullivan, Sara Bareilles, Drew Gehling, Charity Dawson, Dakin Matthews",ur2898520
tt0022489,Tonight or Never,1931,"Comedy, Romance",6.0,Mervyn LeRoy,"Gloria Swanson, Melvyn Douglas, Alison Skipworth, Ferdinand Gottschalk",ur2898520
tt13836144,Filmmakers for the Prosecution,2021 TV Movie,"Documentary, History",7.0,Jean-Christophe Klotz,"Victor Barbat, Yves Beigbeder, Axel Fischer, Niklas Frank",ur2898520
tt0019729,The Broadway Melody,1929,"Drama, Musical, Romance",8.0,Harry Beaumont,"Bessie Love, Anita Page, Charles King, Eddie Kane",ur2898520
tt0025617,The Painted Veil,1934,"Drama, Romance",7.0,Richard Boleslawski,"Greta Garbo, Herbert Marshall, George Brent, Warner Oland",ur2898520
tt15239678,Dune: Part Two,2024,"Action, Adventure, Drama",8.0,Denis Villeneuve,"Timothée Chalamet, Zendaya, Rebecca Ferguson, Javier Bardem",ur2898520
tt14371926,Apples Never Fall,2024,"Drama, Mystery",6.0,Annette Bening,"Sam Neill, Jake Lacy, Conor Merrigan Turner",ur2898520
tt0052291,This Happy Feeling,1958,Comedy,6.0,Blake Edwards,"Debbie Reynolds, Curd Jürgens, John Saxon, Alexis Smith",ur2898520
tt0033677,The Great Lie,1941,Drama,7.0,Edmund Goulding,"Bette Davis, George Brent, Mary Astor, Lucile Watson",ur44584461
tt0087800,A Nightmare on Elm Street,1984,Horror,8.0,Wes Craven,"Heather Langenkamp, Johnny Depp, Robert Englund, John Saxon",ur44584461
tt0040308,Easter Parade,1948,"Musical, Romance",7.0,Charles Walters,"Judy Garland, Fred Astaire, Peter Lawford, Ann Miller",ur44584461
tt0109127,Angels in the Outfield,1994,"Comedy, Drama, Family",5.0,William Dear,"Danny Glover, Brenda Fricker, Tony Danza, Christopher Lloyd",ur44584461
tt0115798,The Cable Guy,1996,"Comedy, Drama, Thriller",7.0,Ben Stiller,"Jim Carrey, Matthew Broderick, Leslie Mann, Jack Black",ur44584461
tt0023825,Bombshell,1933,"Comedy, Drama, Mystery",7.0,Victor Fleming,"Jean Harlow, Lee Tracy, Frank Morgan, Franchot Tone",ur44584461
tt0108778, Friends,1994–2004,"Comedy, Romance",8.0,David Schwimmer,"Jennifer Aniston, Courteney Cox, Lisa Kudrow, Matt LeBlanc",ur44584461
tt0108778, Friends,1994–2004,"Comedy, Romance",8.0,Kevin Bright,"Jennifer Aniston, Courteney Cox, Lisa Kudrow, Matt LeBlanc",ur44584461
tt0082405,The Four Seasons,1981,"Comedy, Drama",6.0,Alan Alda,"Alan Alda, Carol Burnett, Len Cariou, Sandy Dennis",ur44584461
tt0108778, Friends,1994–2004,"Comedy, Romance",8.0,Kevin Bright,"Jennifer Aniston, Courteney Cox, Lisa Kudrow, Matt LeBlanc",ur44584461
tt0108778, Friends,1994–2004,"Comedy, Romance",9.0,Gary Halvorson,"Jennifer Aniston, Courteney Cox, Lisa Kudrow, Matt LeBlanc",ur44584461
tt0108778, Friends,1994–2004,"Comedy, Romance",8.0,Michael Lembeck,"Jennifer Aniston, Courteney Cox, Lisa Kudrow, Matt LeBlanc",ur44584461
tt0108778, Friends,1994–2004,"Comedy, Romance",7.0,Kevin Bright,"Jennifer Aniston, Courteney Cox, Lisa Kudrow, Matt LeBlanc",ur44584461
tt0108778, Friends,1994–2004,"Comedy, Romance",9.0,Kevin Bright,"Jennifer Aniston, Courteney Cox, Lisa Kudrow, Matt LeBlanc",ur44584461
tt0108778, Friends,1994–2004,"Comedy, Romance",9.0,Kevin Bright,"Jennifer Aniston, Courteney Cox, Lisa Kudrow, Matt LeBlanc",ur44584461
tt6298000,The Last of Us: Part II,2020 Video Game,"Action, Adventure, Drama",8.0,Neil Druckmann,"Kurt Margenau, Anthony Newman, Ashley Johnson, Troy Baker, Derek Phillips, Jeffrey Pierce",ur77927383
tt0119528,Liar Liar,1997,"Comedy, Fantasy",8.0,Tom Shadyac,"Jim Carrey, Maura Tierney, Amanda Donohoe, Jennifer Tilly",ur77927383
tt3032476, Better Call Saul,2015–2022,"Crime, Drama",10.0,Vince Gilligan,"Bob Odenkirk, Jonathan Banks, Rhea Seehorn, Patrick Fabian",ur77927383
tt0110912,Pulp Fiction,1994,"Crime, Drama",10.0,Quentin Tarantino,"John Travolta, Uma Thurman, Samuel L. Jackson, Bruce Willis",ur77927383
tt0420981,Tony Hawk's Underground 2,2004 Video Game,"Action, Comedy, Sport",8.0,Larry Cedar,"Ben Diskin, Melissa Disney, Jeff Fischer",ur77927383
tt0080749,The Fog,1980,"Horror, Thriller",9.0,John Carpenter,"Adrienne Barbeau, Jamie Lee Curtis, Janet Leigh, John Houseman",ur77927383
tt0067309,Klute,1971,"Crime, Mystery, Thriller",7.0,Alan J. Pakula,"Jane Fonda, Donald Sutherland, Charles Cioffi, Roy Scheider",ur77927383
tt0091419,Little Shop of Horrors,1986,"Comedy, Horror, Musical",9.0,Frank Oz,"Rick Moranis, Ellen Greene, Vincent Gardenia, Levi Stubbs",ur77927383
tt8097030,Turning Red,2022,"Animation, Adventure, Comedy",7.0,Domee Shi,"Rosalie Chiang, Sandra Oh, Ava Morse, Hyein Park",ur77927383
tt5463162,Deadpool 2,2018,"Action, Adventure, Comedy",9.0,David Leitch,"Ryan Reynolds, Josh Brolin, Morena Baccarin, Julian Dennison",ur77927383
tt0271263,Eight Crazy Nights,2002,"Animation, Comedy, Musical",9.0,Seth Kearsley,"Adam Sandler, Rob Schneider, Jackie Sandler, Austin Stout",ur77927383
tt6587046,The Boy and the Heron,2023,"Animation, Adventure, Drama",10.0,Hayao Miyazaki,"Soma Santoki, Masaki Suda, Kô Shibasaki, Aimyon",ur77927383
tt0093857,Revenge of the Nerds II: Nerds in Paradise,1987,Comedy,7.0,Joe Roth,"Robert Carradine, Curtis Armstrong, Larry B. Scott, Timothy Busfield",ur77927383
tt0088000,Revenge of the Nerds,1984,Comedy,8.0,Jeff Kanew,"Robert Carradine, Anthony Edwards, Timothy Busfield, Andrew Cassese",ur77927383
tt1979376,Toy Story 4,2019,"Animation, Adventure, Comedy",10.0,Josh Cooley,"Tom Hanks, Tim Allen, Annie Potts, Tony Hale",ur77927383
tt0065669,The Dunwich Horror,1970,Horror,7.0,Daniel Haller,"Sandra Dee, Dean Stockwell, Ed Begley, Lloyd Bochner",ur9725326
tt0057890,The Black Torment,1964,"Horror, Mystery",7.0,Robert Hartford-Davis,"Heather Sears, John Turner, Ann Lynn, Peter Arne",ur9725326
tt0078869,The Black Hole,1979,"Action, Sci-Fi",7.0,Gary Nelson,"Maximilian Schell, Anthony Perkins, Robert Forster, Joseph Bottoms",ur9725326
tt6791350,Guardians of the Galaxy Vol. 3,2023,"Action, Adventure, Comedy",7.0,James Gunn,"Chris Pratt, Chukwudi Iwuji, Bradley Cooper, Pom Klementieff",ur9725326
tt0312723,The Ghost of Sierra de Cobre,1964 TV Movie,"Horror, Mystery, Thriller",7.0,Joseph Stefano,"Martin Landau, Judith Anderson, Diane Baker, Tom Simcox",ur9725326
tt10954600,Ant-Man and the Wasp: Quantumania,2023,"Action, Adventure, Comedy",6.0,Peyton Reed,"Paul Rudd, Evangeline Lilly, Michael Douglas, Michelle Pfeiffer",ur9725326
tt1462764,Indiana Jones and the Dial of Destiny,2023,"Action, Adventure, Sci-Fi",5.0,James Mangold,"Harrison Ford, Phoebe Waller-Bridge, Antonio Banderas, Karen Allen",ur9725326
tt9114286,Black Panther: Wakanda Forever,2022,"Action, Adventure, Drama",8.0,Ryan Coogler,"Letitia Wright, Lupita Nyong'o, Danai Gurira, Winston Duke",ur9725326
tt6565702,Dark Phoenix,2019,"Action, Adventure, Sci-Fi",6.0,Simon Kinberg,"James McAvoy, Michael Fassbender, Jennifer Lawrence, Nicholas Hoult",ur9725326
tt0439572,The Flash,I) (2023,"Action, Adventure, Fantasy",6.0,Andy Muschietti,"Ezra Miller, Michael Keaton, Sasha Calle, Michael Shannon",ur9725326
tt6294822,The Post,2017,"Biography, Drama, History",8.0,Steven Spielberg,"Meryl Streep, Tom Hanks, Sarah Paulson, Bob Odenkirk",ur9725326
tt0091083,From Beyond,1986,"Horror, Sci-Fi",4.0,Stuart Gordon,"Jeffrey Combs, Barbara Crampton, Ted Sorel, Ken Foree",ur9725326
tt0079668,The Onion Field,1979,"Crime, Drama",8.0,Harold Becker,"John Savage, James Woods, Franklyn Seales, Ted Danson",ur9725326
tt0056777, The Outer Limits,1963–1965,"Fantasy, Horror, Sci-Fi",9.0,Byron Haskin,"Robert Culp, Arlene Martel, Abraham Sofaer, Rex Holman",ur9725326
tt0440963,The Bourne Ultimatum,2007,"Action, Mystery, Thriller",7.0,Paul Greengrass,"Matt Damon, Edgar Ramírez, Joan Allen, Julia Stiles",ur9725326
tt0050233,Cast a Dark Shadow,1955,"Crime, Film-Noir, Thriller",8.0,Lewis Gilbert,"Dirk Bogarde, Margaret Lockwood, Kay Walsh, Kathleen Harrison",ur13977076
tt0054953,The Guns of Navarone,1961,"Action, Adventure, Drama",9.0,J. Lee Thompson,"David Niven, Gregory Peck, Anthony Quinn, Anthony Quayle",ur13977076
tt0107362,Last Action Hero,1993,"Action, Adventure, Comedy",8.0,John McTiernan,"Arnold Schwarzenegger, F. Murray Abraham, Art Carney, Charles Dance",ur13977076
tt0041968,Too Late for Tears,1949,"Crime, Film-Noir",9.0,Byron Haskin,"Lizabeth Scott, Don DeFore, Dan Duryea, Arthur Kennedy",ur13977076
tt30495098,The Foolish Angel Dances with the Devil,2024– ,"Animation, Comedy, Fantasy",7.0,Yuma Uchida,"Ayane Sakura, Lindsay Sheppard, Nao Tôyama",ur13977076
tt30494894,Delusional Monthly Magazine,2024– ,"Animation, Comedy, Fantasy",6.0,Shunichi Toki,"Yûsuke Shirai, Kazutomi Yamamoto, Takahide Ishii",ur13977076
tt28247170,Doctor Elise: The Royal Lady with the Lamp,2024– ,"Animation, Fantasy, Romance",7.0,Yui Ishikawa,"Daisuke Ono, Hiro Shimono, Yôji Ueda",ur13977076
tt0049210,Finger of Guilt,1956,"Drama, Film-Noir",7.0,Joseph Losey,"Alec C. Snowden, Richard Basehart, Mary Murphy, Constance Cummings, Roger Livesey",ur13977076
tt30644010,The Weakest Tamer Began a Journey to Pick Up Trash,2024– ,"Animation, Adventure, Fantasy",8.0,Reshel Mae,"Mutsumi Tamura, Tomokazu Sugita, Marina Inoue",ur13977076
tt30495119,Villainess Level 99: I May Be the Hidden Boss but I'm Not the Demon Lord,2024– ,"Animation, Action, Comedy",8.0,Fairouz Ai,"Taku Yashiro, Azumi Waki, Yuma Uchida",ur13977076
tt0042707,The Man Who Cheated Himself,1950,"Crime, Drama, Film-Noir",8.0,Felix E. Feist,"Lee J. Cobb, Jane Wyatt, John Dall, Lisa Howard",ur13977076
tt30643998,"'Tis Time for ""Torture, "" Princess",2024– ,"Animation, Comedy, Fantasy",8.0,Shizuka Itou,"Haruka Shiraishi, Chikahiro Kobayashi, Jun Fukushima",ur13977076
tt23029874,Hokkaido Gals Are Super Adorable!,2024– ,"Animation, Comedy, Romance",8.0,Matt Shipman,"Mikaela Krantz, Yôko Imaizumi, Reina Ueda",ur13977076
tt29467317,Mr. Villain's Day Off,2024– ,"Animation, Comedy",7.0,Shintarô Asanuma,"Hiiro Ishibashi, Hibiku Yamamura, Sôma Saitô",ur13977076
tt30024091,A Sign of Affection,2024– ,"Animation, Comedy, Drama",9.0,Sumire Morohoshi,"Yu Miyazaki, Takeo Otsuka, Reagan Murdock",ur13977076
tt2741602, The Blacklist,2013–2023,"Crime, Drama, Mystery",10.0,Donald E. Thorin Jr.,"James Spader, Megan Boone, Diego Klattenhoff, Ryan Eggold",ur4823391
tt5013056,Dunkirk,2017,"Action, Drama, History",8.0,Christopher Nolan,"Fionn Whitehead, Barry Keoghan, Mark Rylance, Tom Hardy",ur4823391
tt3450958,War for the Planet of the Apes,2017,"Action, Adventure, Drama",8.0,Matt Reeves,"Andy Serkis, Woody Harrelson, Steve Zahn, Karin Konoval",ur4823391
tt3896198,Guardians of the Galaxy Vol. 2,2017,"Action, Adventure, Comedy",7.0,James Gunn,"Chris Pratt, Zoe Saldana, Dave Bautista, Vin Diesel",ur4823391
tt3315342,Logan,2017,"Action, Drama, Sci-Fi",9.0,James Mangold,"Hugh Jackman, Patrick Stewart, Dafne Keen, Boyd Holbrook",ur4823391
tt2771200,Beauty and the Beast,I) (2017,"Adventure, Family, Fantasy",6.0,Bill Condon,"Emma Watson, Dan Stevens, Luke Evans, Josh Gad",ur4823391
tt1619029,Jackie,V) (2016,"Biography, Drama",5.0,Pablo Larraín,"Natalie Portman, Peter Sarsgaard, Greta Gerwig, Billy Crudup",ur4823391
tt3783958,La La Land,2016,"Comedy, Drama, Music",7.0,Damien Chazelle,"Ryan Gosling, Emma Stone, Rosemarie DeWitt, J.K. Simmons",ur4823391
tt3748528,Rogue One: A Star Wars Story,2016,"Action, Adventure, Sci-Fi",8.0,Gareth Edwards,"Felicity Jones, Diego Luna, Alan Tudyk, Donnie Yen",ur4823391
tt3183660,Fantastic Beasts and Where to Find Them,2016,"Adventure, Family, Fantasy",5.0,David Yates,"Eddie Redmayne, Katherine Waterston, Alison Sudol, Dan Fogler",ur4823391
tt4262980,Shin Godzilla,2016,"Action, Drama, Horror",8.0,Hideaki Anno,"Shinji Higuchi, Hiroki Hasegawa, Yutaka Takenouchi, Satomi Ishihara, Ren Ôsugi",ur4823391
tt4196450,The Birth of a Nation,2016,"Biography, Drama, History",6.0,Nate Parker,"Nate Parker, Armie Hammer, Penelope Ann Miller, Jackie Earle Haley",ur4823391
tt4302938,Kubo and the Two Strings,2016,"Animation, Action, Adventure",9.0,Travis Knight,"Charlize Theron, Art Parkinson, Matthew McConaughey, Ralph Fiennes",ur4823391
tt1386697,Suicide Squad,2016,"Action, Adventure, Fantasy",4.0,David Ayer,"Will Smith, Jared Leto, Margot Robbie, Viola Davis",ur4823391
tt0770828,Man of Steel,2013,"Action, Adventure, Sci-Fi",5.0,Zack Snyder,"Henry Cavill, Amy Adams, Michael Shannon, Diane Lane",ur4823391
tt1051906,The Invisible Man,I) (2020,"Drama, Horror, Mystery",8.0,Leigh Whannell,"Elisabeth Moss, Oliver Jackson-Cohen, Harriet Dyer, Aldis Hodge",ur16161013
tt0134154,Ride with the Devil,I) (1999,"Drama, Romance, War",9.0,Ang Lee,"Tobey Maguire, Skeet Ulrich, Jewel, Jeremy W. Auman",ur16161013
tt0103919,Candyman,1992,"Horror, Thriller",7.0,Bernard Rose,"Virginia Madsen, Xander Berkeley, Tony Todd, Kasi Lemmons",ur16161013
tt0065895,Machine Gun McCain,1969,"Action, Crime, Drama",7.0,Giuliano Montaldo,"John Cassavetes, Britt Ekland, Peter Falk, Gabriele Ferzetti",ur16161013
tt0064133,Carry on Camping,1969,Comedy,8.0,Gerald Thomas,"Sidney James, Kenneth Williams, Charles Hawtrey, Joan Sims",ur16161013
tt0059932,Young Fury,1964,Western,5.0,Christian Nyby,"Rory Calhoun, Virginia Mayo, William Bendix, Lon Chaney Jr.",ur16161013
tt0118880,Con Air,1997,"Action, Crime, Thriller",8.0,Simon West,"Nicolas Cage, John Cusack, John Malkovich, Colm Meaney",ur16161013
tt1634106,Bloodshot,2020,"Action, Adventure, Sci-Fi",6.0,Dave Wilson,"Vin Diesel, Eiza González, Sam Heughan, Toby Kebbell",ur16161013
tt0045783,Fort Algiers,1953,"Action, Adventure, Drama",6.0,Lesley Selander,"Yvonne De Carlo, Carlos Thompson, Raymond Burr, Leif Erickson",ur16161013
tt0054389,Shoot the Piano Player,1960,"Crime, Drama, Thriller",8.0,François Truffaut,"Charles Aznavour, Marie Dubois, Nicole Berger, Michèle Mercier",ur16161013
tt0066090,The Molly Maguires,1970,"Drama, History",7.0,Martin Ritt,"Sean Connery, Richard Harris, Samantha Eggar, Frank Finlay",ur16161013
tt0092099,Top Gun,1986,"Action, Drama",7.0,Tony Scott,"Tom Cruise, Tim Robbins, Kelly McGillis, Val Kilmer",ur16161013
tt0113957,The Net,I) (1995,"Action, Crime, Drama",6.0,Irwin Winkler,"Sandra Bullock, Jeremy Northam, Dennis Miller, Diane Baker",ur16161013
tt0913354,Armored,2009,"Action, Crime, Mystery",7.0,Nimród Antal,"Columbus Short, Matt Dillon, Laurence Fishburne, Jean Reno",ur16161013
tt1663662,Pacific Rim,2013,"Action, Adventure, Sci-Fi",8.0,Guillermo del Toro,"Idris Elba, Charlie Hunnam, Rinko Kikuchi, Charlie Day",ur16161013
tt1323594,Despicable Me,2010,"Animation, Adventure, Comedy",7.0,Pierre Coffin,"Chris Renaud, Steve Carell, Jason Segel, Russell Brand, Julie Andrews",ur11423174
tt3315342,Logan,2017,"Action, Drama, Sci-Fi",7.0,James Mangold,"Hugh Jackman, Patrick Stewart, Dafne Keen, Boyd Holbrook",ur11423174
tt0454876,Life of Pi,2012,"Adventure, Drama, Fantasy",5.0,Ang Lee,"Suraj Sharma, Irrfan Khan, Adil Hussain, Tabu",ur11423174
tt0382932,Ratatouille,2007,"Animation, Adventure, Comedy",3.0,Brad Bird,"Jan Pinkava, Brad Garrett, Lou Romano, Patton Oswalt, Ian Holm",ur11423174
tt0086250,Scarface,1983,"Crime, Drama",3.0,Brian De Palma,"Al Pacino, Michelle Pfeiffer, Steven Bauer, Mary Elizabeth Mastrantonio",ur11423174
tt1431045,Deadpool,2016,"Action, Comedy",8.0,Tim Miller,"Ryan Reynolds, Morena Baccarin, T.J. Miller, Ed Skrein",ur11423174
tt2267998,Gone Girl,2014,"Drama, Mystery, Thriller",9.0,David Fincher,"Ben Affleck, Rosamund Pike, Neil Patrick Harris, Tyler Perry",ur11423174
tt0790636,Dallas Buyers Club,2013,"Biography, Drama",6.0,Jean-Marc Vallée,"Matthew McConaughey, Jennifer Garner, Jared Leto, Steve Zahn",ur11423174
tt0378194,Kill Bill: Vol. 2,2004,"Action, Crime, Thriller",7.0,Quentin Tarantino,"Uma Thurman, David Carradine, Michael Madsen, Daryl Hannah",ur11423174
tt0208092,Snatch,2000,"Comedy, Crime",8.0,Guy Ritchie,"Jason Statham, Brad Pitt, Stephen Graham, Vinnie Jones",ur11423174
tt0088847,The Breakfast Club,1985,"Comedy, Drama",7.0,John Hughes,"Emilio Estevez, Judd Nelson, Molly Ringwald, Ally Sheedy",ur11423174
tt0120338,Titanic,1997,"Drama, Romance",8.0,James Cameron,"Leonardo DiCaprio, Kate Winslet, Billy Zane, Kathy Bates",ur11423174
tt0093058,Full Metal Jacket,1987,"Drama, War",7.0,Stanley Kubrick,"Matthew Modine, R. Lee Ermey, Vincent D'Onofrio, Adam Baldwin",ur11423174
tt1010048,Slumdog Millionaire,2008,"Crime, Drama, Romance",3.0,Danny Boyle,"Loveleen Tandan, Dev Patel, Freida Pinto, Saurabh Shukla, Anil Kapoor",ur11423174
tt0266697,Kill Bill: Vol. 1,2003,"Action, Crime, Thriller",7.0,Quentin Tarantino,"Uma Thurman, David Carradine, Daryl Hannah, Michael Madsen",ur11423174
tt5097050,Chewing Gum,2015–2017,Comedy,8.0,Michaela Coel,"Danielle Walters, Robert Lonsdale, Shola Adewusi",ur49370025
tt7131622,Once Upon a Time... in Hollywood,2019,"Comedy, Drama",9.0,Quentin Tarantino,"Leonardo DiCaprio, Brad Pitt, Margot Robbie, Emile Hirsch",ur49370025
tt0258463,The Bourne Identity,2002,"Action, Mystery, Thriller",8.0,Doug Liman,"Franka Potente, Matt Damon, Chris Cooper, Clive Owen",ur49370025
tt7984734,The Lighthouse,I) (2019,"Drama, Fantasy, Horror",9.0,Robert Eggers,"Robert Pattinson, Willem Dafoe, Valeriia Karaman, Logan Hawkes",ur49370025
tt0289765,Red Dragon,2002,"Crime, Drama, Thriller",5.0,Brett Ratner,"Anthony Hopkins, Edward Norton, Ralph Fiennes, Harvey Keitel",ur49370025
